{
  "schemaVersion": "1.0.0",
  "occupancyCandidateId": "af7db853-4626-5387-95a3-c76a113e9917",
  "seatId": "9557dd8f-409a-56bd-b245-0c3e2e7ceb84",
  "seatKey": "fl-florida-state-senator-district-19-19",
  "mappedExpectedSeatKey": "fl-florida-state-senator-district-19-19",
  "mappingStatus": "unique_seat",
  "verificationStatus": "RECOVERED",
  "candidateKind": "person_officeholder",
  "displayName": "Debbie Mayfield",
  "officeTitle": "Florida State Senator, District 19",
  "governmentLevel": "state",
  "districtNumber": "19",
  "personCandidateId": "aeba71d6-2a4b-5238-a09a-aa641a779edc",
  "canonicalPersonId": null,
  "canonicalRecordExists": false,
  "sourceKind": "profile_research_queue",
  "sourceKey": "florida-senate-members",
  "sourceUrl": "https://www.flsenate.gov/Senators/2024-2026/S19",
  "sourceSnapshotSha256": "80cb3183d121d74b9ae0d54c25555393fd4ce03b315d043fa407afaf1e4e78ad",
  "recoveredFrom": "data/operations/florida-profile-research-queue.json",
  "queueTaskId": "7ba3ad62-5098-51fa-a329-ec7025243bc9",
  "portraitStatus": "pending_official_or_licensed_source",
  "notes": "Recovered from florida-profile-research-queue.json. Recovered queue data is RECOVERED, not independently VERIFIED.",
  "createdAt": "2026-09-01T22:30:00Z"
}
