{
  "schemaVersion": "1.0.0",
  "occupancyCandidateId": "6dc1ac6e-4aaf-537b-bf2b-ef64b38b4905",
  "seatId": "e49e4b8a-eca7-5a07-b1b7-7f03121bafc0",
  "seatKey": "fl-florida-state-representative-district-75-75",
  "mappedExpectedSeatKey": "fl-florida-state-representative-district-75-75",
  "mappingStatus": "unique_seat",
  "verificationStatus": "RECOVERED",
  "candidateKind": "person_officeholder",
  "displayName": "Danny Nix Jr.",
  "officeTitle": "Florida State Representative, District 75",
  "governmentLevel": "state",
  "districtNumber": "75",
  "personCandidateId": "d1db4e86-4e97-5a00-8a43-a44613c37de8",
  "canonicalPersonId": null,
  "canonicalRecordExists": false,
  "sourceKind": "profile_research_queue",
  "sourceKey": "florida-house-members",
  "sourceUrl": "https://www.flhouse.gov/Sections/Representatives/details.aspx?MemberId=4921&LegislativeTermId=91",
  "sourceSnapshotSha256": "39b4b44148275e1f1346dc40bcda8863b5091a858ea827920128a564312f9d99",
  "recoveredFrom": "data/operations/florida-profile-research-queue.json",
  "queueTaskId": "dd000936-ef6f-5610-8cc6-b5a5bde0deee",
  "portraitStatus": "pending_official_or_licensed_source",
  "notes": "Recovered from florida-profile-research-queue.json. Recovered queue data is RECOVERED, not independently VERIFIED.",
  "createdAt": "2026-09-01T22:30:00Z"
}
