{
  "schemaVersion": "1.0.0",
  "occupancyCandidateId": "a61c668c-28a1-5867-abae-bc4d0aa2a1ad",
  "seatId": "3cd22c92-ccd7-591a-8fe8-b0f642d629ff",
  "seatKey": "fl-florida-state-senator-district-25-25",
  "mappedExpectedSeatKey": "fl-florida-state-senator-district-25-25",
  "mappingStatus": "unique_seat",
  "verificationStatus": "RECOVERED",
  "candidateKind": "person_officeholder",
  "displayName": "Kristen Aston Arrington",
  "officeTitle": "Florida State Senator, District 25",
  "governmentLevel": "state",
  "districtNumber": "25",
  "personCandidateId": "cfc7dcff-1562-5a36-a735-e5e96878a776",
  "canonicalPersonId": null,
  "canonicalRecordExists": false,
  "sourceKind": "profile_research_queue",
  "sourceKey": "florida-senate-members",
  "sourceUrl": "https://www.flsenate.gov/Senators/2024-2026/S25",
  "sourceSnapshotSha256": "80cb3183d121d74b9ae0d54c25555393fd4ce03b315d043fa407afaf1e4e78ad",
  "recoveredFrom": "data/operations/florida-profile-research-queue.json",
  "queueTaskId": "93283e27-47df-5da4-bbb9-8df081812501",
  "portraitStatus": "pending_official_or_licensed_source",
  "notes": "Recovered from florida-profile-research-queue.json. Recovered queue data is RECOVERED, not independently VERIFIED.",
  "createdAt": "2026-09-01T22:30:00Z"
}
