{
  "schemaVersion": "1.0.0",
  "occupancyCandidateId": "358d1540-5c24-57d3-a92a-c1a505ef46fa",
  "seatId": "b0f383e0-8d07-5d3a-932c-8fea63e78fff",
  "seatKey": "fl-florida-state-representative-district-103-103",
  "mappedExpectedSeatKey": "fl-florida-state-representative-district-103-103",
  "mappingStatus": "unique_seat",
  "verificationStatus": "RECOVERED",
  "candidateKind": "person_officeholder",
  "displayName": "Robin Bartleman",
  "officeTitle": "Florida State Representative, District 103",
  "governmentLevel": "state",
  "districtNumber": "103",
  "personCandidateId": "71c3f7c8-3a7e-5d26-bef9-6c2c31fba620",
  "canonicalPersonId": null,
  "canonicalRecordExists": false,
  "sourceKind": "profile_research_queue",
  "sourceKey": "florida-house-members",
  "sourceUrl": "https://www.flhouse.gov/Sections/Representatives/details.aspx?MemberId=4793&LegislativeTermId=91",
  "sourceSnapshotSha256": "39b4b44148275e1f1346dc40bcda8863b5091a858ea827920128a564312f9d99",
  "recoveredFrom": "data/operations/florida-profile-research-queue.json",
  "queueTaskId": "3b78285e-96e3-5087-a60b-f0ff7d28fc1e",
  "portraitStatus": "pending_official_or_licensed_source",
  "notes": "Recovered from florida-profile-research-queue.json. Recovered queue data is RECOVERED, not independently VERIFIED.",
  "createdAt": "2026-09-01T22:30:00Z"
}
