{
  "schemaVersion": "1.0.0",
  "occupancyCandidateId": "bd311a08-1d20-5b60-9337-d120a8af9373",
  "seatId": "c89ed092-ac8d-594a-817b-c62c471b85ba",
  "seatKey": "fl-united-states-representative-13",
  "mappedExpectedSeatKey": "fl-united-states-representative-13",
  "mappingStatus": "unique_seat",
  "verificationStatus": "RECOVERED",
  "candidateKind": "person_officeholder",
  "displayName": "Anna Paulina Luna",
  "officeTitle": "United States Representative",
  "governmentLevel": "federal",
  "districtNumber": "13",
  "personCandidateId": "9f4f781b-9f98-5e8d-9cc5-9b17dd294bad",
  "canonicalPersonId": null,
  "canonicalRecordExists": false,
  "sourceKind": "profile_research_queue",
  "sourceKey": "us-house-members",
  "sourceUrl": "https://luna.house.gov",
  "sourceSnapshotSha256": "810e17d99b704ea3b2720a49433af0864653130511accb2f912aadef6b979aab",
  "recoveredFrom": "data/operations/florida-profile-research-queue.json",
  "queueTaskId": "471c664a-795a-5b0f-bf55-f09cf0f9d2f7",
  "portraitStatus": "pending_official_or_licensed_source",
  "notes": "Recovered from florida-profile-research-queue.json. Recovered queue data is RECOVERED, not independently VERIFIED.",
  "createdAt": "2026-09-01T22:30:00Z"
}
