{
  "schemaVersion": "1.0.0",
  "occupancyCandidateId": "9709ecbb-e452-573c-90b8-a42d6fa31358",
  "seatId": "500f5574-70fa-5f0e-8c8d-258f03c651b0",
  "seatKey": "fl-florida-state-representative-district-35-35",
  "mappedExpectedSeatKey": "fl-florida-state-representative-district-35-35",
  "mappingStatus": "unique_seat",
  "verificationStatus": "RECOVERED",
  "candidateKind": "person_officeholder",
  "displayName": "Erika Booth",
  "officeTitle": "Florida State Representative, District 35",
  "governmentLevel": "state",
  "districtNumber": "35",
  "personCandidateId": "5e60fbea-d21d-576e-91b8-f56170c7ac7b",
  "canonicalPersonId": null,
  "canonicalRecordExists": false,
  "sourceKind": "profile_research_queue",
  "sourceKey": "florida-house-members",
  "sourceUrl": "https://www.flhouse.gov/Sections/Representatives/details.aspx?MemberId=4914&LegislativeTermId=91",
  "sourceSnapshotSha256": "39b4b44148275e1f1346dc40bcda8863b5091a858ea827920128a564312f9d99",
  "recoveredFrom": "data/operations/florida-profile-research-queue.json",
  "queueTaskId": "b24522af-d64f-5e3b-a446-ec1f5173800b",
  "portraitStatus": "pending_official_or_licensed_source",
  "notes": "Recovered from florida-profile-research-queue.json. Recovered queue data is RECOVERED, not independently VERIFIED.",
  "createdAt": "2026-09-01T22:30:00Z"
}
