{
  "schemaVersion": "1.0.0",
  "occupancyCandidateId": "23e71aa4-cee3-507b-9c40-188fe3f70a01",
  "seatId": "53c84155-220b-5694-a41a-935f01e1b45a",
  "seatKey": "fl-florida-state-representative-district-30-30",
  "mappedExpectedSeatKey": "fl-florida-state-representative-district-30-30",
  "mappingStatus": "unique_seat",
  "verificationStatus": "RECOVERED",
  "candidateKind": "person_officeholder",
  "displayName": "Chase Tramont",
  "officeTitle": "Florida State Representative, District 30",
  "governmentLevel": "state",
  "districtNumber": "30",
  "personCandidateId": "605cd512-299e-5ab9-b68a-43b1fa292f2a",
  "canonicalPersonId": null,
  "canonicalRecordExists": false,
  "sourceKind": "profile_research_queue",
  "sourceKey": "florida-house-members",
  "sourceUrl": "https://www.flhouse.gov/Sections/Representatives/details.aspx?MemberId=4867&LegislativeTermId=91",
  "sourceSnapshotSha256": "39b4b44148275e1f1346dc40bcda8863b5091a858ea827920128a564312f9d99",
  "recoveredFrom": "data/operations/florida-profile-research-queue.json",
  "queueTaskId": "4c96f2c3-23ac-59f0-ab63-0dee9cbceac4",
  "portraitStatus": "pending_official_or_licensed_source",
  "notes": "Recovered from florida-profile-research-queue.json. Recovered queue data is RECOVERED, not independently VERIFIED.",
  "createdAt": "2026-09-01T22:30:00Z"
}
