{
  "schemaVersion": "1.0.0",
  "occupancyCandidateId": "9215165c-c51d-5af2-92a2-bff84db7132c",
  "seatId": "170181fc-4ccf-5138-bbc1-0e9d653c6fc5",
  "seatKey": "fl-florida-state-representative-district-53-53",
  "mappedExpectedSeatKey": "fl-florida-state-representative-district-53-53",
  "mappingStatus": "unique_seat",
  "verificationStatus": "RECOVERED",
  "candidateKind": "person_officeholder",
  "displayName": "Jeff Holcomb",
  "officeTitle": "Florida State Representative, District 53",
  "governmentLevel": "state",
  "districtNumber": "53",
  "personCandidateId": "e83e0378-c8aa-5334-ace8-7bfca56c1a10",
  "canonicalPersonId": null,
  "canonicalRecordExists": false,
  "sourceKind": "profile_research_queue",
  "sourceKey": "florida-house-members",
  "sourceUrl": "https://www.flhouse.gov/Sections/Representatives/details.aspx?MemberId=4890&LegislativeTermId=91",
  "sourceSnapshotSha256": "39b4b44148275e1f1346dc40bcda8863b5091a858ea827920128a564312f9d99",
  "recoveredFrom": "data/operations/florida-profile-research-queue.json",
  "queueTaskId": "d028a50f-17ae-5876-92f0-9ae6db0525f3",
  "portraitStatus": "pending_official_or_licensed_source",
  "notes": "Recovered from florida-profile-research-queue.json. Recovered queue data is RECOVERED, not independently VERIFIED.",
  "createdAt": "2026-09-01T22:30:00Z"
}
