{
  "schemaVersion": "1.0.0",
  "occupancyCandidateId": "4a0f3c8d-fa95-5cf5-a857-d8196856d1c2",
  "seatId": "56ca747a-b7a5-5766-a74c-6a314b92c048",
  "seatKey": "fl-florida-state-representative-district-4-4",
  "mappedExpectedSeatKey": "fl-florida-state-representative-district-4-4",
  "mappingStatus": "unique_seat",
  "verificationStatus": "RECOVERED",
  "candidateKind": "person_officeholder",
  "displayName": "Patt Maney",
  "officeTitle": "Florida State Representative, District 4",
  "governmentLevel": "state",
  "districtNumber": "4",
  "personCandidateId": "7bb234f1-0849-5d06-8eae-0e4f17c5ea28",
  "canonicalPersonId": null,
  "canonicalRecordExists": false,
  "sourceKind": "profile_research_queue",
  "sourceKey": "florida-house-members",
  "sourceUrl": "https://www.flhouse.gov/Sections/Representatives/details.aspx?MemberId=4764&LegislativeTermId=91",
  "sourceSnapshotSha256": "39b4b44148275e1f1346dc40bcda8863b5091a858ea827920128a564312f9d99",
  "recoveredFrom": "data/operations/florida-profile-research-queue.json",
  "queueTaskId": "5ca86f82-d8ff-570a-ae61-cf5f087dab85",
  "portraitStatus": "pending_official_or_licensed_source",
  "notes": "Recovered from florida-profile-research-queue.json. Recovered queue data is RECOVERED, not independently VERIFIED.",
  "createdAt": "2026-09-01T22:30:00Z"
}
