{
  "schemaVersion": "1.0.0",
  "occupancyCandidateId": "32e034b5-1aeb-5182-9ef7-3727e35e3e18",
  "seatId": "9188e92e-d54a-5c03-9bc3-c83b854a67f8",
  "seatKey": "fl-florida-state-representative-district-58-58",
  "mappedExpectedSeatKey": "fl-florida-state-representative-district-58-58",
  "mappingStatus": "unique_seat",
  "verificationStatus": "RECOVERED",
  "candidateKind": "person_officeholder",
  "displayName": "Kimberly Berfield",
  "officeTitle": "Florida State Representative, District 58",
  "governmentLevel": "state",
  "districtNumber": "58",
  "personCandidateId": "791e6582-f039-5c3b-90e6-1cea81d76563",
  "canonicalPersonId": null,
  "canonicalRecordExists": false,
  "sourceKind": "profile_research_queue",
  "sourceKey": "florida-house-members",
  "sourceUrl": "https://www.flhouse.gov/Sections/Representatives/details.aspx?MemberId=4210&LegislativeTermId=91",
  "sourceSnapshotSha256": "39b4b44148275e1f1346dc40bcda8863b5091a858ea827920128a564312f9d99",
  "recoveredFrom": "data/operations/florida-profile-research-queue.json",
  "queueTaskId": "1866e024-9274-5e47-ace0-48e959bf80cd",
  "portraitStatus": "pending_official_or_licensed_source",
  "notes": "Recovered from florida-profile-research-queue.json. Recovered queue data is RECOVERED, not independently VERIFIED.",
  "createdAt": "2026-09-01T22:30:00Z"
}
