{
  "schemaVersion": "1.0.0",
  "occupancyCandidateId": "34bb56dd-30df-5c0d-a5d9-65144959ede3",
  "seatId": "e97a6f9a-e96f-5c2f-9bc8-585b1a1a315a",
  "seatKey": "fl-florida-state-representative-district-19-19",
  "mappedExpectedSeatKey": "fl-florida-state-representative-district-19-19",
  "mappingStatus": "unique_seat",
  "verificationStatus": "RECOVERED",
  "candidateKind": "person_officeholder",
  "displayName": "Sam Greco",
  "officeTitle": "Florida State Representative, District 19",
  "governmentLevel": "state",
  "districtNumber": "19",
  "personCandidateId": "fa1328fc-cfe1-5474-ba6b-f364fb2c55e5",
  "canonicalPersonId": null,
  "canonicalRecordExists": false,
  "sourceKind": "profile_research_queue",
  "sourceKey": "florida-house-members",
  "sourceUrl": "https://www.flhouse.gov/Sections/Representatives/details.aspx?MemberId=4906&LegislativeTermId=91",
  "sourceSnapshotSha256": "39b4b44148275e1f1346dc40bcda8863b5091a858ea827920128a564312f9d99",
  "recoveredFrom": "data/operations/florida-profile-research-queue.json",
  "queueTaskId": "8fdf46de-0128-5cdd-85b8-9a0c22789c77",
  "portraitStatus": "pending_official_or_licensed_source",
  "notes": "Recovered from florida-profile-research-queue.json. Recovered queue data is RECOVERED, not independently VERIFIED.",
  "createdAt": "2026-09-01T22:30:00Z"
}
