{
  "schemaVersion": "1.0.0",
  "occupancyCandidateId": "32d91697-fb6c-5016-a7a1-a55a20cd9447",
  "seatId": "d97c0437-7dee-5418-abea-5d00fc042c77",
  "seatKey": "fl-florida-state-representative-district-16-16",
  "mappedExpectedSeatKey": "fl-florida-state-representative-district-16-16",
  "mappingStatus": "unique_seat",
  "verificationStatus": "RECOVERED",
  "candidateKind": "person_officeholder",
  "displayName": "Kiyan Michael",
  "officeTitle": "Florida State Representative, District 16",
  "governmentLevel": "state",
  "districtNumber": "16",
  "personCandidateId": "cab73259-17d4-57d6-bd66-50241314b6a3",
  "canonicalPersonId": null,
  "canonicalRecordExists": false,
  "sourceKind": "profile_research_queue",
  "sourceKey": "florida-house-members",
  "sourceUrl": "https://www.flhouse.gov/Sections/Representatives/details.aspx?MemberId=4869&LegislativeTermId=91",
  "sourceSnapshotSha256": "39b4b44148275e1f1346dc40bcda8863b5091a858ea827920128a564312f9d99",
  "recoveredFrom": "data/operations/florida-profile-research-queue.json",
  "queueTaskId": "c37bc37a-df2c-5ccc-afab-1f3076a79b5c",
  "portraitStatus": "pending_official_or_licensed_source",
  "notes": "Recovered from florida-profile-research-queue.json. Recovered queue data is RECOVERED, not independently VERIFIED.",
  "createdAt": "2026-09-01T22:30:00Z"
}
