{
  "schemaVersion": "1.0.0",
  "occupancyCandidateId": "35a04b2c-c03a-5425-a3d2-2f40defbb60e",
  "seatId": "d890d318-019e-5bac-9ea4-7b874a0ec8b6",
  "seatKey": "fl-florida-state-senator-district-36-36",
  "mappedExpectedSeatKey": "fl-florida-state-senator-district-36-36",
  "mappingStatus": "unique_seat",
  "verificationStatus": "RECOVERED",
  "candidateKind": "person_officeholder",
  "displayName": "Ileana Garcia",
  "officeTitle": "Florida State Senator, District 36",
  "governmentLevel": "state",
  "districtNumber": "36",
  "personCandidateId": "c2f05808-cee2-5407-aa0d-13d17aecb434",
  "canonicalPersonId": null,
  "canonicalRecordExists": false,
  "sourceKind": "profile_research_queue",
  "sourceKey": "florida-senate-members",
  "sourceUrl": "https://www.flsenate.gov/Senators/2024-2026/S36",
  "sourceSnapshotSha256": "80cb3183d121d74b9ae0d54c25555393fd4ce03b315d043fa407afaf1e4e78ad",
  "recoveredFrom": "data/operations/florida-profile-research-queue.json",
  "queueTaskId": "953f2ec4-e94b-5c5d-89b2-2da58b59993b",
  "portraitStatus": "pending_official_or_licensed_source",
  "notes": "Recovered from florida-profile-research-queue.json. Recovered queue data is RECOVERED, not independently VERIFIED.",
  "createdAt": "2026-09-01T22:30:00Z"
}
